{
  "authority_boundary": {
    "allowed": [
      "local_read",
      "local_write_workspace",
      "advisory_review"
    ],
    "forbidden": [
      "credential_entry",
      "payment",
      "secret_exfiltration"
    ],
    "requires_auth": [
      "external_dispatch",
      "publish_deploy_push",
      "taskpool_lifecycle_write",
      "destructive_operation"
    ]
  },
  "constraints": [
    "objective_evidence_required_for_completion_claims",
    "model_judgment_is_advisory"
  ],
  "created_at": "2026-07-07T03:36:12+00:00",
  "goal": "Verify local external workspace projection skeleton",
  "id": "external-jspace-p0-smoke-20260707033612",
  "intermediate_beliefs": [],
  "missing_evidence": [],
  "next_action_contract": {
    "action": "add_evidence_then_gate_check",
    "expected_evidence": [
      "root_evidence"
    ]
  },
  "non_goals": [
    "no_hidden_state_claim",
    "no_external_side_effects_in_p0",
    "no_taskpool_lifecycle_mutation_in_p0"
  ],
  "risks": [],
  "schema": "workspace_projection_v0_1",
  "task_id": null,
  "title": "External J-space P0 smoke",
  "updated_at": "2026-07-07T03:36:12+00:00",
  "workspace_state": "objective_model"
}
